{
  "schemaVersion": 1,
  "id": "watchbuddy-sprout",
  "displayName": "Sprout（芽芽）",
  "description": "WatchBuddy 的原创薄荷绿腕上 AI 伙伴。",
  "renderer": "frame-sequence-v1",
  "source": {
    "format": "codex-pet-v2",
    "spriteVersionNumber": 2,
    "sourceUrl": "https://github.com/1122414/WatchBuddy/tree/main/assets/pets/watchbuddy-sprout/source",
    "author": "WatchBuddy",
    "license": {
      "name": "WatchBuddy Asset License 1.0",
      "url": "https://github.com/1122414/WatchBuddy/blob/main/assets/pets/watchbuddy-sprout/LICENSE.md",
      "redistributionAllowed": true
    },
    "attribution": "Sprout（芽芽）, an original WatchBuddy mascot.",
    "sha256": "724e14cc69c83502d1f363f0e33cd424f3db930d6abae90acdb34b0a1e03a040"
  },
  "frame": {
    "width": 128,
    "height": 139,
    "displayWidth": 176,
    "displayHeight": 176
  },
  "assets": [
    {
      "id": "idle-0",
      "path": "frames/idle/000.webp",
      "sha256": "03afb0ef93a42b56f9e3dafc4c4374458e9b08a67610c6ba62fa73a81427796e",
      "bytes": 4626
    },
    {
      "id": "idle-1",
      "path": "frames/idle/001.webp",
      "sha256": "6f7f3d5d34a9c23c7322b4256e37989f28ab3a3707a05974372b95c70342464e",
      "bytes": 4662
    },
    {
      "id": "idle-2",
      "path": "frames/idle/002.webp",
      "sha256": "52057b5557285a4e0cf101e3b47ec33ec1f3b6137b1f52ed723f42b2f3e52e81",
      "bytes": 4472
    },
    {
      "id": "idle-3",
      "path": "frames/idle/003.webp",
      "sha256": "e6ab6072351d601bd020a2451900b65e0fd5031d46ebf3b99078059b2d405bc6",
      "bytes": 4676
    },
    {
      "id": "idle-4",
      "path": "frames/idle/004.webp",
      "sha256": "36a9fdf31e2b9cbdef16a7564504cbf0f7f7e082071d526d44d0a3fd0a90d235",
      "bytes": 4590
    },
    {
      "id": "idle-5",
      "path": "frames/idle/005.webp",
      "sha256": "fbdb980f9fcdb5837b7fab922e5fbf32d4d70157d417b156839990f245e88def",
      "bytes": 4586
    },
    {
      "id": "running-right-0",
      "path": "frames/running-right/000.webp",
      "sha256": "29c04e9308798633277e43bae718f24814a056163e3ff5eeeead833009b85950",
      "bytes": 4812
    },
    {
      "id": "running-right-1",
      "path": "frames/running-right/001.webp",
      "sha256": "65d877a66b8b446e600753dd5950a0498a468a0c04c76c168710edff18761860",
      "bytes": 4850
    },
    {
      "id": "running-right-2",
      "path": "frames/running-right/002.webp",
      "sha256": "6fa85f6f12b3460e72ec3a26c61d0f4e377ffbe902f71b3b267f804c417321f8",
      "bytes": 4890
    },
    {
      "id": "running-right-3",
      "path": "frames/running-right/003.webp",
      "sha256": "b3d6b7405e073ded63429a1b2b710a4c09dc519c5b1565cdef0f9ff8ea895812",
      "bytes": 4802
    },
    {
      "id": "running-right-4",
      "path": "frames/running-right/004.webp",
      "sha256": "4a1886331415bbea9e57274f91e209c391611ac6036f4befb808c6fd4bba4021",
      "bytes": 4436
    },
    {
      "id": "running-right-5",
      "path": "frames/running-right/005.webp",
      "sha256": "6b03d2663f0d166dbd74f3054cddc61e8ba9e282e26333225e74ac5fa90f13ae",
      "bytes": 4628
    },
    {
      "id": "running-right-6",
      "path": "frames/running-right/006.webp",
      "sha256": "ba24b32f8e11a9708b2a45d8310773f7fe69c37acaade858941ce387d70afefa",
      "bytes": 4732
    },
    {
      "id": "running-right-7",
      "path": "frames/running-right/007.webp",
      "sha256": "70b85582c7f8888b7feefc0a41b36d407449a8859c2f496f09c539a8d1385dc0",
      "bytes": 4434
    },
    {
      "id": "running-left-0",
      "path": "frames/running-left/000.webp",
      "sha256": "f622dc4c9c0dfb91da77beeda1544e914777355d81cd903eaec31341a67bfa26",
      "bytes": 4832
    },
    {
      "id": "running-left-1",
      "path": "frames/running-left/001.webp",
      "sha256": "5e858c46877fa827ccc8624a4d59e7a70edd47f1ffb4435aa81edb62408cac16",
      "bytes": 4806
    },
    {
      "id": "running-left-2",
      "path": "frames/running-left/002.webp",
      "sha256": "e0c15b9c5d9ecea70a5ce5f76d681da6f5bf636c7d78a83e5307d121f8d27883",
      "bytes": 4924
    },
    {
      "id": "running-left-3",
      "path": "frames/running-left/003.webp",
      "sha256": "25fdb79af25e62324c6443b8906879105d6c20b406a7dde268ba853fae7a6de4",
      "bytes": 4730
    },
    {
      "id": "running-left-4",
      "path": "frames/running-left/004.webp",
      "sha256": "19325fb0f5f73ce64d65d63887a719bea8ab8b3ee9ab07ef6437f37ef2e1d20c",
      "bytes": 4448
    },
    {
      "id": "running-left-5",
      "path": "frames/running-left/005.webp",
      "sha256": "4e8201422e240d9b26910582c71c421409a4ca6aafa4463db35a14248f990403",
      "bytes": 4634
    },
    {
      "id": "running-left-6",
      "path": "frames/running-left/006.webp",
      "sha256": "646d0b7b59714523386520d1fa72517f87affe0f6dad507c558e62f82e912c46",
      "bytes": 4724
    },
    {
      "id": "running-left-7",
      "path": "frames/running-left/007.webp",
      "sha256": "95297b3c3b84ef8bd1e392a85267aa3788746f9275c53fd7d39ab9a838a2ccf7",
      "bytes": 4424
    },
    {
      "id": "waving-0",
      "path": "frames/waving/000.webp",
      "sha256": "91a0de1c975a6c37dd7d9bbbeac9864738285b3b01bf01f7481f9263ec2c2285",
      "bytes": 4642
    },
    {
      "id": "waving-1",
      "path": "frames/waving/001.webp",
      "sha256": "cab1a67a081a397c65ddd960df5e6dea0ad5accd241156edd6d43271f5ad90fe",
      "bytes": 4838
    },
    {
      "id": "waving-2",
      "path": "frames/waving/002.webp",
      "sha256": "39599d852603318b0d9e83d77f48a28f3e3ec5f092c0e7f83fc2b9267d3316eb",
      "bytes": 4684
    },
    {
      "id": "waving-3",
      "path": "frames/waving/003.webp",
      "sha256": "fa47a8ff1bbc55ee21ecfa9d8d8e5c77917acc1695c7b9ab0ff2c0e22e911b01",
      "bytes": 4714
    },
    {
      "id": "jumping-0",
      "path": "frames/jumping/000.webp",
      "sha256": "81bfeadb3bcb13d567aa5e3a4f6c3aecb07d87fa57719de5cb60bec028d29b3e",
      "bytes": 3144
    },
    {
      "id": "jumping-1",
      "path": "frames/jumping/001.webp",
      "sha256": "1851271b31b9ceb2ad64f0e577001d817de74d39051d2a9a09d892f598378033",
      "bytes": 3340
    },
    {
      "id": "jumping-2",
      "path": "frames/jumping/002.webp",
      "sha256": "c543e32efd8ebfdacca92dfbfeb8cfb6d05b0f5bd3fd7712c464d115ec705aa5",
      "bytes": 3292
    },
    {
      "id": "jumping-3",
      "path": "frames/jumping/003.webp",
      "sha256": "176fb122b601d8e30366845fdaef4a20f7687c330e7d0d5d814e29497889b48a",
      "bytes": 3242
    },
    {
      "id": "jumping-4",
      "path": "frames/jumping/004.webp",
      "sha256": "ae2d5492e9da2c7bee944fe67db5d2342afcd6a66c1c7da165ab5460c6041cbb",
      "bytes": 3122
    },
    {
      "id": "failed-0",
      "path": "frames/failed/000.webp",
      "sha256": "e28f4cdf5504464dbf61e1d60066b5da133a2996ff390a7fe738be6975ff2784",
      "bytes": 4496
    },
    {
      "id": "failed-1",
      "path": "frames/failed/001.webp",
      "sha256": "086ea62e36cebeeafc0f2ceb0922b88a96d3584d0aca0e5d66739c60656fa2a7",
      "bytes": 4720
    },
    {
      "id": "failed-2",
      "path": "frames/failed/002.webp",
      "sha256": "289db6f121a7a37e0ab94c772f6e586461bf9f2f3eb697d2c444dea6e196ebf7",
      "bytes": 4528
    },
    {
      "id": "failed-3",
      "path": "frames/failed/003.webp",
      "sha256": "a89e7fbec28a14a9383fadb804a97b7b0cbc773b474313dedd355f260b0efd95",
      "bytes": 4742
    },
    {
      "id": "failed-4",
      "path": "frames/failed/004.webp",
      "sha256": "553e13e0839052f68c62b7ba2ced2742ca5524dee8e3836d1d2c8b00c8f6663c",
      "bytes": 4586
    },
    {
      "id": "failed-5",
      "path": "frames/failed/005.webp",
      "sha256": "3cf2514fcba57f5051edcde5277de9dafa0aef95c951d8966fa4fe887a620d1e",
      "bytes": 4762
    },
    {
      "id": "failed-6",
      "path": "frames/failed/006.webp",
      "sha256": "57a89cb792fe6dbbb9014479f8936a968b31b918bba6a977304877f3a84d238b",
      "bytes": 4476
    },
    {
      "id": "failed-7",
      "path": "frames/failed/007.webp",
      "sha256": "be3ed0f5dfc5cdfebf022bfea0f13c8b9607367707541fe6ca82b1b6d7fc966c",
      "bytes": 3794
    },
    {
      "id": "waiting-0",
      "path": "frames/waiting/000.webp",
      "sha256": "0e075327eed929aa82e9daac2a0075884aacc8c2221919f322dc6dba0bdf573e",
      "bytes": 4592
    },
    {
      "id": "waiting-1",
      "path": "frames/waiting/001.webp",
      "sha256": "aa74489b0a7f3b5d5aa281ae3c5e04d0e4e34c0d6810ca3cf19d447ad4fc8684",
      "bytes": 4798
    },
    {
      "id": "waiting-2",
      "path": "frames/waiting/002.webp",
      "sha256": "04caccb446aad81e7e62d7f17745a3ec06d95b7d4e7c1a983c00349c617dec10",
      "bytes": 4604
    },
    {
      "id": "waiting-3",
      "path": "frames/waiting/003.webp",
      "sha256": "5e5d47773f1723d72fbda08ebe67edced2e9216d0c570af4d31541aee07f732a",
      "bytes": 5116
    },
    {
      "id": "waiting-4",
      "path": "frames/waiting/004.webp",
      "sha256": "34381e1f10e7f1090265a8d4812276b5ab1295af6db88d931d5dde36f942bb4d",
      "bytes": 4652
    },
    {
      "id": "waiting-5",
      "path": "frames/waiting/005.webp",
      "sha256": "3fbe4166e6707a01e790c2293233faa0f0b9b92b2630952b3a2d7c1a9ec2c94e",
      "bytes": 4454
    },
    {
      "id": "running-0",
      "path": "frames/running/000.webp",
      "sha256": "9cc5bea3bc73560d3539acfba5649d24a8e3da9d4751b05a41f9d4e6dcb983c0",
      "bytes": 4692
    },
    {
      "id": "running-1",
      "path": "frames/running/001.webp",
      "sha256": "54c3fc3000662bae13ac31edeffd5f34ab92542beb932eab0bb1f61a7e7ba218",
      "bytes": 4626
    },
    {
      "id": "running-2",
      "path": "frames/running/002.webp",
      "sha256": "125e0ba47618f5377fed720b9605aa885e2fdc94e638ac937826376ba54a28fd",
      "bytes": 4600
    },
    {
      "id": "running-3",
      "path": "frames/running/003.webp",
      "sha256": "46d0b9e4ef57c032479ee405e591da7cffd0cb01ce669d7a5b663a9f93f8c198",
      "bytes": 4680
    },
    {
      "id": "running-4",